{
  "page": "log in",
  "description": "Selectors for log in page (discovered at https://staging.hyrddsa.com/auth)",
  "elements": {
    "button": {
      "key": "button",
      "primary": "button.btn",
      "fallbacks": [],
      "metadata": {
        "type": "button",
        "label": "العربية",
        "description": "Button: العربية"
      }
    },
    "buttonSignin": {
      "key": "buttonSignin",
      "primary": "button.btn",
      "fallbacks": [],
      "metadata": {
        "type": "button",
        "label": "Sign In",
        "description": "Button: Sign In"
      }
    },
    "button2": {
      "key": "button2",
      "primary": "button.btn",
      "fallbacks": [],
      "metadata": {
        "type": "button",
        "description": "Button: unlabeled"
      }
    },
    "button3": {
      "key": "button3",
      "primary": "button.btn",
      "fallbacks": [],
      "metadata": {
        "type": "button",
        "description": "Button: unlabeled"
      }
    },
    "buttonSigninusing": {
      "key": "buttonSigninusing",
      "primary": "button.btn",
      "fallbacks": [],
      "metadata": {
        "type": "button",
        "label": "Sign In Using",
        "description": "Button: Sign In Using"
      }
    },
    "button5": {
      "key": "button5",
      "primary": "button.btn",
      "fallbacks": [],
      "metadata": {
        "type": "button",
        "description": "Button: unlabeled"
      }
    },
    "button6": {
      "key": "button6",
      "primary": "button.btn",
      "fallbacks": [],
      "metadata": {
        "type": "button",
        "description": "Button: unlabeled"
      }
    },
    "inputEmail": {
      "key": "inputEmail",
      "primary": "[name=\"email\"]",
      "fallbacks": [
        "[aria-label=\"text-box\"]",
        "input.form-control"
      ],
      "metadata": {
        "type": "input",
        "placeholder": "you@example.com",
        "name": "email",
        "label": "you@example.com",
        "description": "Input field: you@example.com"
      }
    },
    "inputPassword": {
      "key": "inputPassword",
      "primary": "[name=\"password\"]",
      "fallbacks": [
        "[aria-label=\"text-box\"]",
        "input.form-control"
      ],
      "metadata": {
        "type": "input",
        "placeholder": "Enter Your Password",
        "name": "password",
        "label": "Enter Your Password",
        "description": "Input field: Enter Your Password"
      }
    },
    "inputRememberme06110858951101084": {
      "key": "inputRememberme06110858951101084",
      "primary": "#rememberMe0.6110858951101084",
      "fallbacks": [
        "input.custom-control-input"
      ],
      "metadata": {
        "type": "input",
        "description": "Input field: checkbox"
      }
    },
    "linkSignup": {
      "key": "linkSignup",
      "primary": "link.mr-3",
      "fallbacks": [],
      "metadata": {
        "type": "link",
        "text": "Sign Up",
        "description": "Link: Sign Up"
      }
    },
    "linkForgetpassword": {
      "key": "linkForgetpassword",
      "primary": "#forget-password",
      "fallbacks": [
        "link.text-decoration-none"
      ],
      "metadata": {
        "type": "link",
        "text": "Forget Password?",
        "description": "Link: Forget Password?"
      }
    },
    "linkResetmultifactorcode": {
      "key": "linkResetmultifactorcode",
      "primary": "#forget-mfa",
      "fallbacks": [
        "link.text-decoration-none"
      ],
      "metadata": {
        "type": "link",
        "text": " Reset Multi-Factor code?",
        "description": "Link:  Reset Multi-Factor code?"
      }
    },
    "linkTermsconditions": {
      "key": "linkTermsconditions",
      "primary": "link.text-heading",
      "fallbacks": [],
      "metadata": {
        "type": "link",
        "text": "Terms & Conditions",
        "description": "Link: Terms & Conditions"
      }
    },
    "linkPrivacypolicy": {
      "key": "linkPrivacypolicy",
      "primary": "link.text-heading",
      "fallbacks": [],
      "metadata": {
        "type": "link",
        "text": "Privacy Policy",
        "description": "Link: Privacy Policy"
      }
    }
  },
  "version": "1.0",
  "lastUpdated": "2025-11-02T15:06:40.201Z"
}