{
  "page": "dashboard",
  "description": "Selectors for login page (URL path: dashboard) at https://staging.hyrddsa.com/",
  "elements": {
    "button": {
      "key": "button",
      "primary": "button.btn",
      "fallbacks": [],
      "metadata": {
        "type": "button",
        "label": "عربي",
        "description": "Button: عربي"
      }
    },
    "buttonMenu": {
      "key": "buttonMenu",
      "primary": "button.burger-menu-btn",
      "fallbacks": [],
      "metadata": {
        "type": "button",
        "label": "menu",
        "description": "Button: menu"
      }
    },
    "linkIndividual": {
      "key": "linkIndividual",
      "primary": "link.text-navey",
      "fallbacks": [],
      "metadata": {
        "type": "link",
        "text": "Individual",
        "description": "Link: Individual"
      }
    },
    "linkBusiness": {
      "key": "linkBusiness",
      "primary": "link.text-navey",
      "fallbacks": [],
      "metadata": {
        "type": "link",
        "text": "Business",
        "description": "Link: Business"
      }
    },
    "linkHelpcenter": {
      "key": "linkHelpcenter",
      "primary": "link.d-flex",
      "fallbacks": [],
      "metadata": {
        "type": "link",
        "text": "\n                    \n                        \n                        \n                        \n                        \n                        \n                    \n                    Help Center",
        "description": "Link: \n                    \n                        \n                        \n                        \n                        \n                        \n                    \n                    Help Center"
      }
    },
    "link": {
      "key": "link",
      "primary": "link",
      "fallbacks": [],
      "metadata": {
        "type": "link",
        "text": "\n                                \n                                    \n                                    \n                                    \n                                        \n                                            \n                                        \n                                        \n                                    \n                                \n                            ",
        "description": "Link: \n                                \n                                    \n                                    \n                                    \n                                        \n                                            \n                                        \n                                        \n                                    \n                                \n                            "
      }
    },
    "linkLogin": {
      "key": "linkLogin",
      "primary": "link.btn",
      "fallbacks": [],
      "metadata": {
        "type": "link",
        "text": " Log In ",
        "description": "Link:  Log In "
      }
    },
    "linkSignup": {
      "key": "linkSignup",
      "primary": "link.btn",
      "fallbacks": [],
      "metadata": {
        "type": "link",
        "text": " Sign Up ",
        "description": "Link:  Sign Up "
      }
    },
    "linkHome": {
      "key": "linkHome",
      "primary": "link.text-dark",
      "fallbacks": [],
      "metadata": {
        "type": "link",
        "text": "Home",
        "description": "Link: Home"
      }
    },
    "linkCareers": {
      "key": "linkCareers",
      "primary": "link.text-dark",
      "fallbacks": [],
      "metadata": {
        "type": "link",
        "text": "Careers",
        "description": "Link: Careers"
      }
    },
    "linkLearnmore": {
      "key": "linkLearnmore",
      "primary": "link.btn-round",
      "fallbacks": [],
      "metadata": {
        "type": "link",
        "text": "learn more",
        "description": "Link: learn more"
      }
    },
    "linkJoinus": {
      "key": "linkJoinus",
      "primary": "link.btn-round",
      "fallbacks": [],
      "metadata": {
        "type": "link",
        "text": "Join us",
        "description": "Link: Join us"
      }
    },
    "linkAboutus": {
      "key": "linkAboutus",
      "primary": "link",
      "fallbacks": [],
      "metadata": {
        "type": "link",
        "text": "About Us",
        "description": "Link: About Us"
      }
    },
    "linkTakaful": {
      "key": "linkTakaful",
      "primary": "link",
      "fallbacks": [],
      "metadata": {
        "type": "link",
        "text": "Takaful",
        "description": "Link: Takaful"
      }
    },
    "linkShariahinsuranceauthorityia": {
      "key": "linkShariahinsuranceauthorityia",
      "primary": "link",
      "fallbacks": [],
      "metadata": {
        "type": "link",
        "text": "Shariah & Insurance Authority (IA)",
        "description": "Link: Shariah & Insurance Authority (IA)"
      }
    }
  },
  "version": "1.0",
  "lastUpdated": "2025-12-28T15:14:58.386Z"
}